{
  "schema_version": "1.0",
  "handoff_id": "handoff-smoke-test-001",
  "created_at": "2026-01-29T12:00:00Z",
  "references": {
    "session_id": "session-smoke",
    "mandate_id": "mandate-smoke-001",
    "motion_id": "motion-smoke-001",
    "rfp_id": "rfp-smoke-001",
    "award_id": "award-smoke-001",
    "selected_duke_id": "duke-agares-smoke",
    "selected_proposal_id": "proposal-smoke-001"
  },
  "work_package": {
    "title": "Smoke Test Work Package",
    "summary": "Validate end-to-end activation slice.",
    "deliverables": [
      {
        "id": "deliv-smoke-1",
        "title": "Activation Validation Report",
        "acceptance_criteria": [
          "TAR emitted with correct schema",
          "Earl routing is witnessed in events"
        ]
      }
    ],
    "constraints": {
      "deadline_iso": "2026-02-15",
      "budget_cap": { "amount": 0, "currency": "USD" },
      "explicit_exclusions": ["NO_PII"]
    }
  },
  "portfolio_context": {
    "portfolios": ["transformation"],
    "portfolios_involved_count": 1
  },
  "admin_directives": {
    "require_task_contracts": true,
    "require_result_artifacts": true,
    "escalation_policy_id": "policy-admin-v1"
  }
}
